{
  "$schema": "https://json-schema.org/draft/2020-12/schema",
  "$defs": {
    "CurrentImplementation": {
      "additionalProperties": false,
      "properties": {
        "required": {
          "title": "Required",
          "type": "boolean"
        },
        "document_authority": {
          "const": "operational_state",
          "title": "Document Authority",
          "type": "string"
        },
        "document": {
          "items": {
            "enum": [
              "../implementations/active/implementation_plan_**.json",
              "../implementations/active/implementation_tracker_**.json"
            ],
            "type": "string"
          },
          "title": "Document",
          "type": "array"
        },
        "schema_ref": {
          "items": {
            "enum": [
              "../implementations/active/ImplementationPlan.schema.json",
              "../implementations/active/ImplementationTracker.schema.json"
            ],
            "type": "string"
          },
          "title": "Schema Ref",
          "type": "array"
        }
      },
      "required": [
        "required",
        "document_authority",
        "document",
        "schema_ref"
      ],
      "title": "CurrentImplementation",
      "type": "object"
    },
    "GovernancePrimitives": {
      "additionalProperties": false,
      "properties": {
        "required": {
          "title": "Required",
          "type": "boolean"
        },
        "document_authority": {
          "const": "invariant_authority",
          "title": "Document Authority",
          "type": "string"
        },
        "document": {
          "const": "./governance_primitives.json",
          "title": "Document",
          "type": "string"
        },
        "schema_ref": {
          "const": "./GovernancePrimitives.schema.json",
          "title": "Schema Ref",
          "type": "string"
        }
      },
      "required": [
        "required",
        "document_authority",
        "document",
        "schema_ref"
      ],
      "title": "GovernancePrimitives",
      "type": "object"
    },
    "KnownFailures": {
      "additionalProperties": false,
      "properties": {
        "required": {
          "title": "Required",
          "type": "boolean"
        },
        "document_authority": {
          "const": "failure_evidence",
          "title": "Document Authority",
          "type": "string"
        },
        "document": {
          "const": "./known_failures.json",
          "title": "Document",
          "type": "string"
        },
        "schema_ref": {
          "const": "./KnownFailures.schema.json",
          "title": "Schema Ref",
          "type": "string"
        }
      },
      "required": [
        "required",
        "document_authority",
        "document",
        "schema_ref"
      ],
      "title": "KnownFailures",
      "type": "object"
    },
    "Metadata": {
      "additionalProperties": false,
      "properties": {
        "id": {
          "title": "Id",
          "type": "string"
        },
        "name": {
          "title": "Name",
          "type": "string"
        }
      },
      "required": [
        "id",
        "name"
      ],
      "title": "Metadata",
      "type": "object"
    },
    "OpenDecisions": {
      "additionalProperties": false,
      "properties": {
        "required": {
          "title": "Required",
          "type": "boolean"
        },
        "document_authority": {
          "const": "operational_state",
          "title": "Document Authority",
          "type": "string"
        },
        "document": {
          "const": "./open_decisions.json",
          "title": "Document",
          "type": "string"
        },
        "schema_ref": {
          "const": "./OpenDecisions.schema.json",
          "title": "Schema Ref",
          "type": "string"
        }
      },
      "required": [
        "required",
        "document_authority",
        "document",
        "schema_ref"
      ],
      "title": "OpenDecisions",
      "type": "object"
    },
    "ProjectSpec": {
      "additionalProperties": false,
      "properties": {
        "required": {
          "title": "Required",
          "type": "boolean"
        },
        "document_authority": {
          "const": "invariant_authority",
          "title": "Document Authority",
          "type": "string"
        },
        "document": {
          "const": "./project_spec.json",
          "title": "Document",
          "type": "string"
        },
        "schema_ref": {
          "const": "./ProjectSpec.schema.json",
          "title": "Schema Ref",
          "type": "string"
        }
      },
      "required": [
        "required",
        "document_authority",
        "document",
        "schema_ref"
      ],
      "title": "ProjectSpec",
      "type": "object"
    }
  },
  "additionalProperties": false,
  "properties": {
    "$schema": {
      "anyOf": [
        {
          "type": "string"
        },
        {
          "type": "null"
        }
      ],
      "default": null,
      "title": "$Schema"
    },
    "metadata": {
      "$ref": "#/$defs/Metadata"
    },
    "project_spec": {
      "$ref": "#/$defs/ProjectSpec"
    },
    "governance_primitives": {
      "$ref": "#/$defs/GovernancePrimitives"
    },
    "known_failures": {
      "$ref": "#/$defs/KnownFailures"
    },
    "open_decisions": {
      "$ref": "#/$defs/OpenDecisions"
    },
    "current_implementation": {
      "$ref": "#/$defs/CurrentImplementation"
    }
  },
  "required": [
    "metadata",
    "project_spec",
    "governance_primitives",
    "known_failures",
    "open_decisions",
    "current_implementation"
  ],
  "title": "ProjectContextPacketManifest",
  "type": "object"
}